main-news	headlines	2014	0171	1.2	6.3-magnitude earthquake hits Taiwan	7.7-magnitude earthquake hits SW Pakistan
main-news	headlines	2015	1335	3.80	India Minister's wife died 'unnatural death' after affair rumours	Minister's wife's death 'unnatural'
main-news	headlines	2015	1338	0.20	3 dead, 1 hurt in shooting at S Carolina oceanfront motel	4 dead, 30 injured in train collision near Moscow
main-news	headlines	2015	1340	1.00	Burial of Boston bombing suspect appears legal	'Ready to go home:' Last Boston bombing victim leaves the hospital
main-news	headlines	2015	1341	1.20	5 killed in S China road cave-in	02:41 156 killed in China earthquake
main-news	headlines	2015	1342	0.00	South Africa president: Mandela is improving	Afghan president delays signing US deal
main-news	headlines	2015	1343	0.60	World News Update, what you need to know	Labour's 50p tax rate: what you need to know
main-news	headlines	2015	1344	1.20	Syrian civil war in photos	Syrian civil war peace talks at risk from Iran invitation
main-news	headlines	2015	1357	1.00	Abdullah Widens Lead in Afghan Presidential Poll	Explosions heard near Afghan presidential palace
main-news	headlines	2015	1358	4.20	Imran blames rival for colleague murder	Pakistans Imran blames rival for killing party member
main-news	headlines	2015	1361	2.80	Bangladesh Honors Factory Victims	Retailers back Bangladesh factory safety pact
main-news	headlines	2015	1362	3.00	Man Who Set Himself on Fire on National Mall Has Died	Man Sets Himself on Fire on National Mall, Flown to Hospital
main-news	headlines	2015	1366	5.00	Japan defends dolphin hunt after US criticism	Japan defends dolphin hunts after criticism from US
main-news	headlines	2015	1367	1.40	Bomb blast rocks shopping mall in Nigeria, 12 killed	Bomb blasts before Indian opposition rally kill 4
main-news	headlines	2015	1368	3.40	Philippines typhoon death toll at 4,460: UN	Philippines typhoon death toll rises above 5,000
main-news	headlines	2015	1371	0.60	Police fire teargas on Venezuelan vote protesters	Chavez heir Maduro wins Venezuela's presidency
main-news	headlines	2015	1373	1.80	Wave of attacks kills at least 95 in Iraq	Suicide attack kills at least 12 in northern Iraq
main-news	headlines	2015	1378	3.40	Top Chinese political advisor meets Greek PM	Top Chinese political advisor meets Yemeni president
main-news	headlines	2015	1379	4.00	Palestinian diplomat injured in explosion in Prague	Palestinian ambassador injured in apartment blast
main-news	headlines	2015	1380	5.00	Ukraine leader pledges crisis talks	Ukraine Leader Pledges Crisis Talks
main-news	headlines	2015	1382	3.00	7 killed in attacks in Iraq	16 killed in series of attacks in Iraq
main-news	headlines	2015	1384	1.20	US military presence in East Asia	NATO ups military presence amid Russian threat
main-news	headlines	2015	1388	5.00	US believes Syrian government used chemical weapons	US suspects Syria used chemical weapons
main-news	headlines	2015	1389	4.00	World powers and Iran to resume expert nuclear talks on Dec. 30	Iran nuclear experts, world powers to resume talks next week
main-news	headlines	2015	1390	1.40	Egypt's Muslim Brotherhood Refuses to Back Down	Egyptian court sentences Muslim Brotherhood leader to life in prison
main-news	headlines	2015	1391	2.20	At least 6 dead in Canada bus, train crash	At least 6 dead in Paris train crash
main-news	headlines	2015	1393	1.80	Chinese president meets Greek PM, calling for stronger partnership	Chinese president meets Indian vice president
main-news	headlines	2015	1394	5.00	AstraZeneca pays $4.1bn to buy Bristol-Myers Squibb out of diabetes alliance	AstraZeneca to buy Bristol out of diabetes venture for up to $4.1 billion
main-news	headlines	2015	1395	0.00	Italian fugitive arrested in Dominican Republic	Australian icebreaker arrives in East Antarctica for new rescue bid
main-news	headlines	2015	1398	1.40	India, US to hold talks on China next week	Egypt to hold more talks with IMF on loan next week
main-news	headlines	2015	1402	4.80	Israel Carrying Out Ground Offensive In Gaza	Israel Launches Ground Offensive In Gaza
main-news	headlines	2015	1404	3.80	Ehud Olmert, former Israeli prime minister, sentenced to six years in jail for corruption	Ehud Olmert sentenced to six years in Israel
main-news	headlines	2015	1406	3.80	Brahimi apologises to Syria over lack of peace progress	Mediator apologizes to Syrians for lack of peace progress
main-news	headlines	2015	1408	0.40	Egyptian protesters issue Morsi resignation ultimatum	Ukraine protesters battle police in new clashes
main-news	headlines	2015	1410	0.00	5 Things to Know About the Sochi Olympics	7 Things to Know About Ethanol
main-news	headlines	2015	1412	2.60	China stocks open lower on Wednesday	China's stocks close lower on Monday
main-news	headlines	2015	1413	3.40	US delays missile test as tensions rise	William Hague: US decision to halt missile test 'sensible'
main-news	headlines	2015	1414	5.00	Fire in Beijing kills 10	Fire in Beijing kills ten
main-news	headlines	2015	1421	3.80	India, China ink border pact; 8 other agreements	India, China ink agreement on trans-border rivers
main-news	headlines	2015	1427	5.00	Venezuela expels three U.S. diplomats	Venezuela Expels 3 U.S. Diplomats
main-news	headlines	2015	1430	5.00	Heavy smog hits north China city, flights cancelled	Heavy Smog Hits North China City, Flights Canceled
main-news	headlines	2015	1433	1.40	Russia claims to have foiled possible terror act	Russia says ballistic 'objects' fired in Mediterranean
main-news	headlines	2015	1436	0.40	3 Chinese tourists killed in Pakistan	Seven kidnappers killed in southern Nigeria
main-news	headlines	2015	1437	0.00	Sevens World Cup within Kenya‚Äôs reach	Clash of Styles in Court Opens Trial in Young Man‚Äôs Death
main-news	headlines	2015	1439	2.60	Gunmen kill 10 foreign tourists in northern Pakistan	Islamic militants kill 9 foreign tourists, 1 Pakistani
main-news	headlines	2015	1440	3.40	Austrian found hoarding 56 stolen skulls in home museum	Stolen skulls found in home museum
main-news	headlines	2015	1443	5.00	Egypt Launches Offensive Against Sinai Militants	Egypt launches offensive against Sinai insurgents
main-news	headlines	2015	1444	4.00	Record-setting Southwest heat wave turns fatal	At least 1 dead, 40 hospitalized in Southwest heat wave
main-news	headlines	2015	1446	4.60	Detroit eligible for bankruptcy protection: U.S. judge	Detroit eligible for bankruptcy protection
main-news	headlines	2015	1448	4.20	British Nobel-Winning Author Doris Lessing Dies	Nobel Prize winning author Doris Lessing dies
main-news	headlines	2015	1452	4.80	Israeli government authorises new settlements ahead of talks	Israel Approves New Settlement Homes Ahead of Peace Talks
main-news	headlines	2015	1458	1.60	Pakistani Taliban chief killed in US drone strike	Funeral for Pakistan Taliban chief 'set to take place'
main-news	headlines	2015	1459	3.60	Putin signs Crimea annexe treaty	09:32 Putin signs off Crimea annexation
main-news	headlines	2015	1460	1.80	FAA continues ban on US flights to Tel Aviv	FAA lifts ban on U.S. flights to Tel Aviv
main-news	headlines	2015	1467	3.20	Chinese envoy rebuts Vietnamese, Philippine accusations over South China Sea	China's Xi tells Vietnam wants peace in South China Sea
main-news	headlines	2015	1469	2.80	Four more people arrested over Australia's largest illegal tobacco importation syndicate	Police target illegal tobacco syndicate
main-news	headlines	2015	1472	0.40	Obama moves to fill Fed board, taps Fischer to be No. 2	Obama voices willingness to talk with GOP on budget
main-news	headlines	2015	1475	1.60	Iran's president condemns use of chemical weapons in Syria	Probe alleged use of chemical weapons in Syria
main-news	headlines	2015	1476	0.40	A society fraying at the edges	Old TV alignments crack at the edges
main-news	headlines	2015	1477	5.00	UN Invites Iran to Syrian Peace Conference	UN: Iran Invited to Attend Syrian Peace Conference
main-news	headlines	2015	1478	0.00	Italy bus crash death toll rises	Starbucks clears college degree path for workers
main-news	headlines	2015	1480	4.20	Soccer Ref Punched by Player Dies	Police: Utah soccer referee punched by player dies
main-news	headlines	2015	1481	0.40	Angela Merkel headed for narrow win in German elections	Malawi's new president sworn in after disputed elections
main-news	headlines	2015	1484	1.20	Israel detains 37 Palestinians as arrest operation continues	Israel criticizes Palestinian stance on settlers
main-news	headlines	2015	1485	1.20	Rebels kill 21 civilians in Syria Alawite village	Bomb kills 18 civilians in Afghanistan
main-news	headlines	2015	1486	5.00	World sends emergency relief to battered Philippines	Typhoon Haiyan: world sends relief to battered Philippines
main-news	headlines	2015	1489	1.20	Palestinian hunger striker, Israel reach deal	Palestinian activist detained in Israeli raid
main-news	headlines	2015	1493	4.80	Assad says Syria will comply with UN arms resolution	Syria's Assad vows to comply with U.N. resolution
main-news	headlines	2015	1496	4.60	South Korean President Sorry For Ferry Response	S. Korean president 'sorry' for ferry disaster
main-news	headlines	2015	1498	0.00	Food price hikes raise concerns in Iran	American Chris Horner wins Tour of Spain
main-news	headlines	2015	1499	2.00	Obama made last-minute decision on Syria approval	Obama mulls limited military action in Syria
main-news	headlines	2016	0012	4	Driver backs into stroller with child, drives off	Driver backs into mom, stroller with child then drives off	Europe Media Monitor (http://emm.newsbrief.eu)	Europe Media Monitor (http://emm.newsbrief.eu)
main-news	headlines	2016	0015	5	Spain Princess Testifies in Historic Fraud Probe	Spain princess testifies in historic fraud probe	Europe Media Monitor (http://emm.newsbrief.eu)	Europe Media Monitor (http://emm.newsbrief.eu)
main-news	headlines	2016	0025	5	Senate confirms Obama nominee to key appeals court	Senate approves Obama nominee to key appeals court	Europe Media Monitor (http://emm.newsbrief.eu)	Europe Media Monitor (http://emm.newsbrief.eu)
main-news	headlines	2016	0044	5	U.N. rights chief presses Egypt on Mursi detention	UN Rights Chief Presses Egypt on Morsi Detention	Europe Media Monitor (http://emm.newsbrief.eu)	Europe Media Monitor (http://emm.newsbrief.eu)
main-news	headlines	2016	0052	5	US Senate confirms Janet Yellen as US Federal Reserve chief	Senate confirms Janet Yellen as next Federal Reserve Chair	Europe Media Monitor (http://emm.newsbrief.eu)	Europe Media Monitor (http://emm.newsbrief.eu)
main-news	headlines	2016	0057	5	Syrian Rebel Groups Battle Each Other in North	Syrian rebel groups battle each other in north	Europe Media Monitor (http://emm.newsbrief.eu)	Europe Media Monitor (http://emm.newsbrief.eu)
main-news	headlines	2016	0063	3	Mayawati demands president's rule in Kashmir	Mayawati demands Presidents rule in Jammu and Kashmir	Europe Media Monitor (http://emm.newsbrief.eu)	Europe Media Monitor (http://emm.newsbrief.eu)
main-news	headlines	2016	0067	4	Uganda's president signs anti-gay bill	Uganda's president signs harsh anti-gay law	Europe Media Monitor (http://emm.newsbrief.eu)	Europe Media Monitor (http://emm.newsbrief.eu)
main-news	headlines	2016	0070	5	Rocks, Tear Gas Fly as Thai Protests Heat Up	Rocks, tear gas fly as Thai protests heat up	Europe Media Monitor (http://emm.newsbrief.eu)	Europe Media Monitor (http://emm.newsbrief.eu)
main-news	headlines	2016	0071	5	Boston bombing suspect buried in Virginia	Boston bomb suspect buried in Virginia cemetery	Europe Media Monitor (http://emm.newsbrief.eu)	Europe Media Monitor (http://emm.newsbrief.eu)
main-news	headlines	2016	0076	5	Six dead in Philippine restaurant blast	6 killed in Philippines restaurant blast	Europe Media Monitor (http://emm.newsbrief.eu)	Europe Media Monitor (http://emm.newsbrief.eu)
main-news	headlines	2016	0081	5	China army newspaper hits out at US's PRISM programme	China army newspaper slams US's PRISM program	Europe Media Monitor (http://emm.newsbrief.eu)	Europe Media Monitor (http://emm.newsbrief.eu)
main-news	headlines	2016	0082	4	Silvio Berlusconi expelled from Italy's parliament	Silvio Berlusconi expelled from parliament	Europe Media Monitor (http://emm.newsbrief.eu)	Europe Media Monitor (http://emm.newsbrief.eu)
main-news	headlines	2016	0103	5	Two killed in Bahrain car explosion	Two killed in Bahrain car blast	Europe Media Monitor (http://emm.newsbrief.eu)	Europe Media Monitor (http://emm.newsbrief.eu)
main-news	headlines	2016	0121	5	Russia warns it will respond if interests attacked in Ukraine	Russia warns it will 'respond' if interests in Ukraine attacked	Europe Media Monitor (http://emm.newsbrief.eu)	Europe Media Monitor (http://emm.newsbrief.eu)
main-news	headlines	2016	0134	4	Hosni Mubarak retrial adjourned until 8 June	Mubarak retrial adjourned to June	Europe Media Monitor (http://emm.newsbrief.eu)	Europe Media Monitor (http://emm.newsbrief.eu)
main-news	headlines	2016	0142	4	Egypt protesters defy cabinet threat to end sit-ins	Egypt protesters defy cabinet threat	Europe Media Monitor (http://emm.newsbrief.eu)	Europe Media Monitor (http://emm.newsbrief.eu)
main-news	headlines	2016	0149	5	Couple marry in the UK's first Scientology wedding	Couple get married in Britain's first Scientology wedding	Europe Media Monitor (http://emm.newsbrief.eu)	Europe Media Monitor (http://emm.newsbrief.eu)
main-news	headlines	2016	0160	4	Qatar's emir hands power to his son	Qatari emir hands power to son Tamim	Europe Media Monitor (http://emm.newsbrief.eu)	Europe Media Monitor (http://emm.newsbrief.eu)
main-news	headlines	2016	0163	3	Philippines typhoon death toll feared to hit 7,000	Philippines typhoon death toll rises above 5,000	Europe Media Monitor (http://emm.newsbrief.eu)	Europe Media Monitor (http://emm.newsbrief.eu)
main-news	headlines	2016	0164	4	Egypt braces for 'Friday of anger' after carnage	Egypt braces for Friday of anger after bloody crackdown	Europe Media Monitor (http://emm.newsbrief.eu)	Europe Media Monitor (http://emm.newsbrief.eu)
main-news	headlines	2016	0170	4	Red Sox Beat Tigers 5-2 to Advance to World Series	Red Sox beat Tigers to reach World Series	Europe Media Monitor (http://emm.newsbrief.eu)	Europe Media Monitor (http://emm.newsbrief.eu)
main-news	headlines	2016	0175	4	China lands Jade Rabbit robot rover on Moon	China lands robot rover on moon	Europe Media Monitor (http://emm.newsbrief.eu)	Europe Media Monitor (http://emm.newsbrief.eu)
main-news	headlines	2016	0192	4	Ukrainian parliament dismisses president	Ukraine's parliament votes to dismiss president	Europe Media Monitor (http://emm.newsbrief.eu)	Europe Media Monitor (http://emm.newsbrief.eu)
main-news	headlines	2016	0193	5	Venezuela lawmakers brawl amid election tensions	Venezuela lawmakers brawl over election	Europe Media Monitor (http://emm.newsbrief.eu)	Europe Media Monitor (http://emm.newsbrief.eu)
main-news	headlines	2016	0198	5	North Korea Warns Foreigners in South, Advising Evacuation	North Korea warns foreigners in South to evacuate	Europe Media Monitor (http://emm.newsbrief.eu)	Europe Media Monitor (http://emm.newsbrief.eu)
main-news	headlines	2016	0201	4	Captain of sunken South Korean ferry arrested	Captain of capsized S Korean Ferry Arrested	Europe Media Monitor (http://emm.newsbrief.eu)	Europe Media Monitor (http://emm.newsbrief.eu)
main-news	headlines	2016	0217	3	Cars, drivers plunge into river after Wash. I-5 bridge collapse	Cars plunge into river as US bridge collapses	Europe Media Monitor (http://emm.newsbrief.eu)	Europe Media Monitor (http://emm.newsbrief.eu)
main-news	headlines	2016	0227	5	Death toll in Syria now tops 100,000	Death toll in Syria over 100,000 so far	Europe Media Monitor (http://emm.newsbrief.eu)	Europe Media Monitor (http://emm.newsbrief.eu)
main-news	headlines	2016	0240	4	Communist rebels ambush Philippine police, kill 7	Communist rebels kill eight Philippine police	Europe Media Monitor (http://emm.newsbrief.eu)	Europe Media Monitor (http://emm.newsbrief.eu)
main-news	headlines	2016	0241	3	Egypt's Morsi faces trial for prison break, murder, says prosecution	Egypt's Morsi faces trial for prison break	Europe Media Monitor (http://emm.newsbrief.eu)	Europe Media Monitor (http://emm.newsbrief.eu)
main-news	headlines	2016	0242	5	Iran Nuclear Talks Enter Third Day	Iran nuclear talks enter crucial third day	Europe Media Monitor (http://emm.newsbrief.eu)	Europe Media Monitor (http://emm.newsbrief.eu)
main-news	headlines	2016	0255	3	Thai army declares martial law	Thailand's army declares martial law, denies coup	Europe Media Monitor (http://emm.newsbrief.eu)	Europe Media Monitor (http://emm.newsbrief.eu)
main-news	headlines	2016	0261	4	Woman dies while riding roller coaster in Texas	Woman dies riding roller coaster at Texas amusement park	Europe Media Monitor (http://emm.newsbrief.eu)	Europe Media Monitor (http://emm.newsbrief.eu)
main-news	headlines	2016	0265	4	Nobel author Doris Lessing dies at 94	Nobel Prize winning author Doris Lessing dies	Europe Media Monitor (http://emm.newsbrief.eu)	Europe Media Monitor (http://emm.newsbrief.eu)
main-news	headlines	2016	0268	5	Over 100 dead as typhoon slams central Philippines	At least 100 dead as typhoon batters Philippines	Europe Media Monitor (http://emm.newsbrief.eu)	Europe Media Monitor (http://emm.newsbrief.eu)
main-news	headlines	2016	0271	4	First post office savings bank ATM opens in Chennai	India's first post office savings bank ATM inaugurated in Chennai	Europe Media Monitor (http://emm.newsbrief.eu)	Europe Media Monitor (http://emm.newsbrief.eu)
main-news	headlines	2016	0272	3	Israel agrees to 12 hour ceasefire	Israel agrees to 24-hour Gaza truce	Europe Media Monitor (http://emm.newsbrief.eu)	Europe Media Monitor (http://emm.newsbrief.eu)
main-news	headlines	2016	0276	3	Quake of 6.2 magnitude strikes off Indonesia's Sumatra - USGS	Earthquake of 6.9 magnitude strikes off Indonesia island	Europe Media Monitor (http://emm.newsbrief.eu)	Europe Media Monitor (http://emm.newsbrief.eu)
main-news	headlines	2016	0287	4	British stuntman fell to his death in wing suit mishap	British stuntman dies in wingsuit mishap in Alps	Europe Media Monitor (http://emm.newsbrief.eu)	Europe Media Monitor (http://emm.newsbrief.eu)
main-news	headlines	2016	0295	5	What makes India vote? Jaipur Lit Fest debates	What makes India vote? Debate at Jaipur Literature Festival	Europe Media Monitor (http://emm.newsbrief.eu)	Europe Media Monitor (http://emm.newsbrief.eu)
main-news	headlines	2016	0309	4	White diamond breaks record in Hong Kong auction	White diamond fetches record $34m at HK auction	Europe Media Monitor (http://emm.newsbrief.eu)	Europe Media Monitor (http://emm.newsbrief.eu)
main-news	headlines	2016	0314	3	Chinese satellite spots large object in search area	Malaysia: Chinese satellite found object in ocean	Europe Media Monitor (http://emm.newsbrief.eu)	Europe Media Monitor (http://emm.newsbrief.eu)
main-news	headlines	2016	0354	5	Hamas Urges Hizbullah to Pull Fighters Out of Syria	Hamas calls on Hezbollah to pull forces out of Syria	Europe Media Monitor (http://emm.newsbrief.eu)	Europe Media Monitor (http://emm.newsbrief.eu)
main-news	headlines	2016	0366	3	U.S. and Russia reach a deal on Syria's chemical weapons	China welcomes US, Russia deal on Syria chemical weapons	Europe Media Monitor (http://emm.newsbrief.eu)	Europe Media Monitor (http://emm.newsbrief.eu)
main-news	headlines	2016	0371	4	PSNI failed RUC officers, tribunal told	13:23 PSNI 'failed RUC officer families'	Europe Media Monitor (http://emm.newsbrief.eu)	Europe Media Monitor (http://emm.newsbrief.eu)
main-news	headlines	2016	0373	5	Stocks edge lower following retail earnings	Stocks edge lower after earnings from retailers	Europe Media Monitor (http://emm.newsbrief.eu)	Europe Media Monitor (http://emm.newsbrief.eu)
main-news	headlines	2016	0377	4	Police helicopter crashes into Scottish pub	Police helicopter crashes on top of bar in Glasgow	Europe Media Monitor (http://emm.newsbrief.eu)	Europe Media Monitor (http://emm.newsbrief.eu)
main-news	headlines	2016	0387	4	US ups pressure on Israel as UN demands Gaza truce	US, UN up pressure on Israel over Gaza	Europe Media Monitor (http://emm.newsbrief.eu)	Europe Media Monitor (http://emm.newsbrief.eu)
main-news	headlines	2016	0401	4	Australian PM says 'Very confident' signals are from black box	Australian PM confident sounds are from Flight 370	Europe Media Monitor (http://emm.newsbrief.eu)	Europe Media Monitor (http://emm.newsbrief.eu)
main-news	headlines	2016	0407	1	Mandela's condition has 'improved'	Mandela's condition has 'worsened over past 48 hours'	Europe Media Monitor (http://emm.newsbrief.eu)	Europe Media Monitor (http://emm.newsbrief.eu)
main-news	headlines	2016	0420	4	Philippe becomes king of Belgium	Philippe ascends throne of divided Belgium	Europe Media Monitor (http://emm.newsbrief.eu)	Europe Media Monitor (http://emm.newsbrief.eu)
main-news	headlines	2016	0427	4	India anti-graft party takes charge in New Delhi	India's Anti-Graft Party Forms Government in Delhi	Europe Media Monitor (http://emm.newsbrief.eu)	Europe Media Monitor (http://emm.newsbrief.eu)
main-news	headlines	2016	0428	5	Spain approves new restrictive abortion law	Spanish government approves tight restrictions on abortion	Europe Media Monitor (http://emm.newsbrief.eu)	Europe Media Monitor (http://emm.newsbrief.eu)
main-news	headlines	2016	0437	2	Obama orders Syria 'gas attack' inquiry	UN urges Syria gas attack inspection	Europe Media Monitor (http://emm.newsbrief.eu)	Europe Media Monitor (http://emm.newsbrief.eu)
main-news	headlines	2016	0455	5	German ambassador's Athens residence shot at	Shots fired at German ambassador's residence in Athens	Europe Media Monitor (http://emm.newsbrief.eu)	Europe Media Monitor (http://emm.newsbrief.eu)
main-news	headlines	2016	0463	2	Ukraine's jailed opposition icon Tymoshenko walks free	Ukraine's opposition chief wants more protests	Europe Media Monitor (http://emm.newsbrief.eu)	Europe Media Monitor (http://emm.newsbrief.eu)
main-news	headlines	2016	0466	3	Oklahoma examines what went wrong in botched execution	Okla. inmate dies of heart attack after botched execution	Europe Media Monitor (http://emm.newsbrief.eu)	Europe Media Monitor (http://emm.newsbrief.eu)
main-news	headlines	2016	0468	5	Napolitano elected for second term as Italy president	Italian President Napolitano elected for second term	Europe Media Monitor (http://emm.newsbrief.eu)	Europe Media Monitor (http://emm.newsbrief.eu)
main-news	headlines	2016	0473	4	UN court convicts 6 Bosnian Croats of atrocities	UN War Crimes Court Convicts Six Bosnians Croats	Europe Media Monitor (http://emm.newsbrief.eu)	Europe Media Monitor (http://emm.newsbrief.eu)
main-news	headlines	2016	0495	4	Saudi man with pressure cooker arrested at Detroit airport	Saudi Man Traveling With Pressure Cooker Arrested	Europe Media Monitor (http://emm.newsbrief.eu)	Europe Media Monitor (http://emm.newsbrief.eu)
main-news	headlines	2016	0517	5	North Korea says to put US citizen on trial	North Korea says detained American tourist to face trial	Europe Media Monitor (http://emm.newsbrief.eu)	Europe Media Monitor (http://emm.newsbrief.eu)
main-news	headlines	2016	0532	3	Thai protests escalate amid violence	Thai protesters call general strike	Europe Media Monitor (http://emm.newsbrief.eu)	Europe Media Monitor (http://emm.newsbrief.eu)
main-news	headlines	2016	0538	3	Egypt imposes state of emergency after 95 people killed	Egypt announces one-month state of emergency nationwide	Europe Media Monitor (http://emm.newsbrief.eu)	Europe Media Monitor (http://emm.newsbrief.eu)
main-news	headlines	2016	0561	4	Rallies demand 'Justice for Trayvon'	Across US, people rally for 'Justice for Trayvon'	Europe Media Monitor (http://emm.newsbrief.eu)	Europe Media Monitor (http://emm.newsbrief.eu)
main-news	headlines	2016	0569	3	UN warns of plight of women, children in Syria's Homs	UNICEF calls for immediate safe access to women, children in Homs	Europe Media Monitor (http://emm.newsbrief.eu)	Europe Media Monitor (http://emm.newsbrief.eu)
main-news	headlines	2016	0573	4	Hagel," Dempsey face Congress over defense budget	Hagel laments ""political"" changes to US defence budget	Europe Media Monitor (http://emm.newsbrief.eu)	Europe Media Monitor (http://emm.newsbrief.eu)"
main-news	headlines	2016	0574	3	Sony to sell PC unit and cut jobs	Sony to axe PC unit in major business overhaul	Europe Media Monitor (http://emm.newsbrief.eu)	Europe Media Monitor (http://emm.newsbrief.eu)
main-news	headlines	2016	0579	2	Man kills 4 in Calif. before police shoot him dead	Police: Gunman killed 6 in California shootings	Europe Media Monitor (http://emm.newsbrief.eu)	Europe Media Monitor (http://emm.newsbrief.eu)
main-news	headlines	2016	0584	2	N. Korea Deports Elderly American	North Korea deports detained US war veteran	Europe Media Monitor (http://emm.newsbrief.eu)	Europe Media Monitor (http://emm.newsbrief.eu)
main-news	headlines	2016	0594	1	Search leader urges caution in findings related to missing Malaysian jetliner	Searchers hoping pings come from lost Malaysian airliner	Europe Media Monitor (http://emm.newsbrief.eu)	Europe Media Monitor (http://emm.newsbrief.eu)
main-news	headlines	2016	0601	1	Mandela remembered by family, as stadium memorial service is planned	Mandela's family thanks nation and world for support	Europe Media Monitor (http://emm.newsbrief.eu)	Europe Media Monitor (http://emm.newsbrief.eu)
main-news	headlines	2016	0622	4	Ukrainian presidency says deal reached at crisis talks	Ukraine rivals sign deal to end crisis	Europe Media Monitor (http://emm.newsbrief.eu)	Europe Media Monitor (http://emm.newsbrief.eu)
main-news	headlines	2016	0627	2	Obama mulls limited military action in Syria	Obama urges military action against Syria, but will seek Congress' OK	Europe Media Monitor (http://emm.newsbrief.eu)	Europe Media Monitor (http://emm.newsbrief.eu)
