main-news	headlines	2014	0171	1.2	6.3-magnitude earthquake hits Taiwan	7.7-magnitude earthquake hits SW Pakistan
main-news	headlines	2014	0172	0.8	Books To Help Kids Talk About Boston Marathon News	Report of two explosions at finish line of Boston Marathon
main-news	headlines	2014	0173	2.6	Tech Sector Heats Up: Google and IBM Post Strong Earnings	Google shares soar past $1,000 on strong earnings
main-news	headlines	2014	0176	1	Profiles of Kenya's presidential candidates	Italian journalist picked as presidential candidate
main-news	headlines	2014	0177	3.4	Israel frees Palestinian prisoners	Gov't committee approves release of 26 Palestinian prisoners
main-news	headlines	2014	0178	4	Philadelphia building collapses, 8-10 people may be trapped	Philadelphia building collapses; reports of people trapped
main-news	headlines	2014	0179	3	Obama meets with Mandela family	Obama meets Zuma and pays tribute to Mandela
main-news	headlines	2014	0180	3.4	U.S. Senate sets off gun control debate	U.S. Senate set to vote on gun control bill
main-news	headlines	2014	0182	1.4	Car bombing kills 53 in Damascus	Car bombings kill 13 civilians in Iraqi capital
main-news	headlines	2014	0183	2.6	'Friends of Syria' in Doha talks on arming rebels	Syria talks agree military aid to rebels
main-news	headlines	2014	0184	2	Syria condemns Israeli air strikes.	Series of deadly attacks strikes Iraq
main-news	headlines	2014	0185	5	Egypt's leader imposes state of emergency in 3 cities	Egypt president declares state of emergency in three cities
main-news	headlines	2014	0186	2.8	ABVP protesters clash with police at Jantar Mantar, throw stones	Protesters clash with police at Jantar Mantar, 5 people detained
main-news	headlines	2014	0187	2.8	Turkish PM urges to end protests in Istanbul	Turkish police fire teargas at protesters in Istanbul
main-news	headlines	2014	0189	1.8	Two men charged with terrorism offences	Saudi-born Nigerian charged with terrorism in New York
main-news	headlines	2014	0190	3.6	EU receives Nobel Peace Prize	EU Receives 2012 Nobel Peace Prize
main-news	headlines	2014	0191	2.6	Start of San Fermin bull-running festival briefly delayed as view obstructed by Basque flag	San Fermin bull-running festival starts
main-news	headlines	2014	0192	2.8	Up to 21, mostly foreigners, killed in Kabul suicide attack	Briton among dead in Kabul suicide attack
main-news	headlines	2014	0193	0	Former LAPD officer sought in Irvine slayings	Former CIA officer sentenced to 30 months in prison for info leak
main-news	headlines	2014	0194	0.8	Tokyo shares close 0.88pc lower	Singapore stocks close 0.44 pct lower
main-news	headlines	2014	0195	0.6	Pakistan court demands 'blasphemy' rampage answers	Pakistan-UN report reveals alarming levels of drug use
main-news	headlines	2014	0196	3.8	Intel's McAfee Buys Cloud-Based, Networked Firewall Specialist Stonesoft For $389M In Cash	McAfee to acquire firewall Stonesoft for $389 million
main-news	headlines	2014	0197	1	4.1 magnitude quake strikes U.S	7.2 magnitude earthquake strikes Philippines
main-news	headlines	2014	0198	3.6	Bangladesh Opposition Leader Sentenced to Death for War Crimes	Bangladesh: Fugitive Sentenced to Death by War Crimes Tribunal
main-news	headlines	2014	0199	4.2	Alleged cop killer died from shot to head	Alleged cop killer died from gunshot
main-news	headlines	2014	0201	4.8	Car bomb at Swedish consulate in Libya's Benghazi, no casualties	Car Bomb Hits Swedish Consulate in Benghazi, None Hurt
main-news	headlines	2014	0202	3	Musharraf arrested in Lal Masjid case	Musharraf arrested in Pakistan
main-news	headlines	2014	0203	4.4	Iran hopes nuclear talks will yield 'roadmap'	Iran Nuclear Talks in Geneva Spur High Hopes
main-news	headlines	2014	0204	2.8	35 militants killed in Afghan raids: official	12 militants killed in Afghan raids: ministry
main-news	headlines	2014	0205	4	North Korea reportedly test-fires short-range missiles	North Korea launches short-range missiles
main-news	headlines	2014	0206	2.8	Thai protesters obstruct vote; 1 dead in violence	Thai protesters block polling stations in Bangkok
main-news	headlines	2014	0207	1.8	Venezuela's Hugo Chavez dies of cancer	Hugo Chavez: Venezuelan officials for unity
main-news	headlines	2014	0208	2.2	North Korea's third test brings it closer to nuclear power status	NATO says North Korea nuclear test is grave threat to world peace
main-news	headlines	2014	0209	4.6	North Korea conducts third nuclear test	North Korea Confirms Third Nuclear Test
main-news	headlines	2014	0210	3.6	Indian stocks open flat	Indian stocks open lower
main-news	headlines	2014	0211	5	Macau Gambling Revenue Hits Record $38 bn in 2012	Macau gambling revenue hits record US$38b in 2012
main-news	headlines	2014	0212	3.8	Israelis, Palestinians resume talks in US	Israelis, Palestinians begin talks
main-news	headlines	2014	0214	2.4	Nelson Mandela memorial service	Nelson Mandela dies: Live coverage
main-news	headlines	2014	0215	3.8	NM County Prepares for Same-Sex Marriages Hearing	Some county officials pave the way for same-sex marriage
main-news	headlines	2014	0217	4	Four U.S. Air Force helicopter crew members killed in UK crash	US Air Force helicopter crew killed in British crash
main-news	headlines	2014	0218	4.2	Tokyo to host 2020 Olympic Games	Tokyo wins race to host 2020 Olympics
main-news	headlines	2014	0219	4	Malaysia detains Australian senator at airport	Malaysia detains Australian lawmaker at airport
main-news	headlines	2014	0222	2.2	South Korea Says North Fired Missiles	North Korea launches short-range missiles
main-news	headlines	2014	0223	3	Britain shuts down plants as horse meat scandal reaches France	EU ministers 'determined' to resolve horsemeat scandal
main-news	headlines	2014	0224	3.2	US warns Syria on chemical weapons	U.S. concerns grow about Syria's chemical weapons
main-news	headlines	2014	0225	1.2	37 killed in bus crash in Italy	12 killed in bus accident in Pakistan
main-news	headlines	2014	0228	3	China yuan strengthens to 6.2689 against USD	Chinese yuan weakens to 6.2816 against USD
main-news	headlines	2014	0229	2	U.S. recognizes Syrian opposition	Russia invites Syrian opposition for talks
main-news	headlines	2014	0231	4.8	Egypt votes in new constitution	Egyptians Vote On New Constitution
main-news	headlines	2014	0232	4.4	Preston and England legend Tom Finney dies at 91	Former England great Tom Finney dies at 91
main-news	headlines	2014	0234	3	Car bomb kills one and wounds five in Benghazi	Car bomb hits Libyan Foreign Ministry in Benghazi
main-news	headlines	2014	0235	3.4	Roadside bombs kill 5 in Afghanistan	Roadside bomb kills 3 policemen in Afghanistan
main-news	headlines	2014	0236	0.4	Sri Lanka's Tamils Vote for Greater Autonomy	Syria talks for Cameron and Putin
main-news	headlines	2014	0237	3.6	French-led troops close in on Timbuktu	French-led troops control access to Timbuktu
main-news	headlines	2014	0238	1.2	Nato airstrike kills two Afghan kids	Nato solider dies in Afghanistan
main-news	headlines	2014	0239	4	Gunmen Kill 11 Foreign Tourists in Pakistan	Gunmen kill 11 foreign climbers in Pakistan
main-news	headlines	2014	0240	4	N Korea to halt work at joint industrial zone	North Korea blocks access to joint industrial zone
main-news	headlines	2014	0241	1.8	Delhi Gang Rape Suspect 'Beaten, Poisoned'	Delhi gang-rape verdict deferred again
main-news	headlines	2014	0243	1.4	France pledges military aid in Mali	Most French support military operation in Mali
main-news	headlines	2014	0245	4	Egyptians vote on divisive constitution	Egyptians vote on constitution change
main-news	headlines	2014	0246	2.8	Reid cites 'tremendous progress' in debt ceiling talks	Senate leaders appear close to US debt ceiling deal
main-news	headlines	2014	0248	2	6.2 magnitude quake jolts Sarangani	4.3-magnitude earthquake jolts SW China
main-news	headlines	2014	0249	1.2	One dead, 11 hurt in LA car chaos	6 dead, 33 hurt in Cotabato blast
main-news	headlines	2014	0250	4.2	Chairman of easyJet to step down	Chairman of British no-frills airline easyJet to step down
main-news	headlines	2014	0251	0.8	Obama renews offer to cut social safety net in big budget deal: aide	Japan urges U.S. to quickly handle budget deadlock
main-news	headlines	2014	0252	2.4	Suicide Bomber Kills 14 at Afghan Province Council	Suicide Bomber Kills 11 in Afghanistan
main-news	headlines	2014	0254	3.4	Committee nears final big immigration decisions	Senate Judiciary Committee nearing final big decisions in shaping immigration bill
main-news	headlines	2014	0255	3.8	US Troops Killed in Afghan Insider Attack	NATO troops killed in Afghan 'insider attack'
main-news	headlines	2014	0256	1.8	Mother arrested on suspicion of manslaughter after dog kills daughter	Man arrested on suspicion of murder after stabbing in Suffolk
main-news	headlines	2014	0259	3.2	Five dead, 40 missing in Canada train disaster	40 still missing in Canadian train wreck
main-news	headlines	2014	0260	3	Tunisian opposition politician shot dead	Tunisia opposition leader slain; protests erupt
main-news	headlines	2014	0262	4.8	UN presses need for major boost in Syrian aid	UN chief presses for major boost in Syrian aid
main-news	headlines	2014	0263	1.6	Stocks soar on Wall St lead	Stocks slump on Wall Street
main-news	headlines	2014	0264	2.6	George Zimmerman found not guilty of Trayvon Martin murder	Protests and appeals for calm after Zimmerman acquitted of Trayvon Martin murder
main-news	headlines	2014	0265	3.6	Whistleblower Edward Snowden flies to Moscow	NSA whistleblower Edward Snowden leaves Hong Kong on flight to Moscow
main-news	headlines	2014	0266	0.6	17 killed, 133 wounded in bomb attacks in northern Iraq	2 killed, 6 wounded in clashes in northern Lebanon
main-news	headlines	2014	0267	1.2	Insiders Reveal 2012 Election Secrets	All Eyes on Capriles as Venezuela Election Set
main-news	headlines	2014	0268	2.8	Royal sorrow over nurse's death	Radio prankster in tears over nurse’s death
main-news	headlines	2014	0269	4.2	N Korea says it may delay controversial rocket launch	N. Korea looks set to delay controversial rocket launch
main-news	headlines	2014	0272	4	Critical Gates memoir rocks Obama administration	Gates blast rocks Obama administration
main-news	headlines	2014	0273	4.2	Jeff Bezos Bets $250 Million on Reviving Washington Post	Jeff Bezos Pays $250 Million For The Washington Post
main-news	headlines	2014	0274	3.8	Brooks pleads not guilty to hacking charges	Brooks pleads not guilty at phone hacking hearing
main-news	headlines	2014	0275	4	Purge sends chilling message to North Korea's elite	Purge of Kim uncle sends chilling message to North Korea’s elite
main-news	headlines	2014	0276	1.4	South Africans mark ailing Mandela's 95th birthday	South Africa's former PM Nelson Mandela back in hospital
main-news	headlines	2014	0277	3	Obama declares health care law is working	Obama pledges to make new health care law work
main-news	headlines	2014	0278	3	Heavy rain raises threat of Christmas Day flooding	Fresh rain brings more flooding
main-news	headlines	2014	0279	3.6	Thousands protest gay marriage	Thousands protest gay marriage in Paris
main-news	headlines	2014	0280	0.4	Taiwan gang leader nabbed at airport after 17 years	Zambia arrests ex-leader Banda over oil deal
main-news	headlines	2014	0282	3	Iran nuke talks begin amid hopes of progress	Iran nuclear talks start in Geneva
main-news	headlines	2014	0283	4.2	Thai political protests paralyse more ministries	Thai protesters besiege more ministries
main-news	headlines	2014	0284	4.6	Amazon's Bezos to buy the Washington Post for $250 million	Amazon's Bezos buys Washington Post for $250-M
main-news	headlines	2014	0285	1.8	Obama economic tour buffeted by low expectations	Obama encourages Boy Scouts to end ban on gays
main-news	headlines	2014	0286	0.6	Israel vows to deny Hezbollah after air strike	Car bomb kills four in Hezbollah Beirut bastion: minister
main-news	headlines	2014	0287	2.4	France Welcomes US-Russia Deal on Syria	Arab League welcomes US-Russian deal on Syria
main-news	headlines	2014	0288	2	More French soldiers to Central African Republic	Gun battles in Central African capital create fresh panic
main-news	headlines	2014	0289	1	UN resolution orders Syria chemical arms destroyed	Germany ready to help Syria chemical mission
main-news	headlines	2014	0290	4.6	Exclusive-UPDATE 2-Egypt pro-Mursi alliance signals flexibility in talks	EXCLUSIVE-UPDATE 1-Egypt pro-Mursi alliance signals flexibility in talks
main-news	headlines	2014	0291	4.2	David Beckham to retire at end of season	David Beckham Retires From Football
main-news	headlines	2014	0293	3.4	Libya abruptly closes its borders with four countries	Libya closes borders, declares martial law in south
main-news	headlines	2014	0294	1	6.0-magnitude quake hits Greece -- USGS	5.0-magnitude quake jolts Japan
main-news	headlines	2014	0295	0.2	Search after man swept into sea	Lara plans visit to Nepal
main-news	headlines	2014	0296	3	Militants stage Pakistan jailbreak	Taliban prison break: 250 militants escape after attack on Pakistan jail
main-news	headlines	2014	0297	3	Meteorite hits central Russia, more than 500 people hurt	Meteorite hits central Russia, 400 hurt
main-news	headlines	2014	0299	4.2	Blizzard brings US northeast to a halt	Blizzard wallops US Northeast, closes roads
main-news	headlines	2014	0300	1.6	NATO protesters acquitted of terrorism charges	NATO protesters convicted on non-terrorism charges
main-news	headlines	2014	0301	1.4	'Credibility on the line over Syria'	Obama: Congress, world credibility on line
main-news	headlines	2014	0302	0	Taliban on agenda for US in Pakistan	At least 33 dead as big quake hits Pakistan
main-news	headlines	2014	0304	5	Egypt interior minister survives bomb	Egypt's interior minister survives bomb attack
main-news	headlines	2014	0305	2	China's yuan weakens to 6.2767 against USD Thursday	China yuan weakens to 6.1818 against USD Tuesday
main-news	headlines	2014	0306	1.4	Obama holds talks over Syria action	Cameron loses parliamentary vote on Syria military action
main-news	headlines	2014	0307	5	Egypt 'freezes Muslim Brotherhood assets'	Egypt freezes Muslim Brotherhood funds
main-news	headlines	2014	0308	0	Zen Report: Ain't easy being high maintenance	Russian meteorite leaves building gaping open
main-news	headlines	2014	0310	4.6	Tony Abbott sworn in as new Australian PM	Tony Abbott Sworn In As Australia PM
main-news	headlines	2014	0311	4	Egypt army cracks down on Brotherhood	Egypt's military cracks down on Muslim Brotherhood
main-news	headlines	2014	0312	3.4	Venezuela assembly meets amid Chavez health crisis	Assembly meets amid Chavez crisis
main-news	headlines	2014	0314	2	Syria opposition threatens to quit talks	Syria opposition agrees to talks
main-news	headlines	2014	0316	2.6	Suicide bomber kills policeman in Pakistan	Suicide Bombers Kill 3 Soldiers in Pakistan
main-news	headlines	2014	0317	0.8	Anti-government protesters storm the streets of Kyiv	Ukraine protesters topple Lenin statue
main-news	headlines	2014	0318	1	Chicago man to be sentenced for terror convictions	Kabul Bank Heads Sentenced for Corruption
main-news	headlines	2014	0319	2.4	US drone strike kills three in northwest Pakistan	US drone strike kills seven in North Waziristan
main-news	headlines	2014	0320	4.2	Track fault disrupts train service between Raffles Place, Marina Bay	Train service disrupted between Raffles Place and Marina Bay
main-news	headlines	2014	0322	1	Manning Sentenced to 35 Years for Leaking Government Secrets	Briton jailed for 10 years for selling fake bomb detectors
main-news	headlines	2014	0323	1	UK police say no terrorism link to helicopter crash	China police seek eight suspects over crash
main-news	headlines	2014	0324	1.8	Suicide bomber kills 13 in Russia's south	Suicide bomber kills 16 in Russia’s Volgograd
main-news	headlines	2014	0325	1.8	41 killed, 22 wounded in violent attacks in Iraq	15 killed, 90 wounded in fresh attacks in Iraq
main-news	headlines	2014	0327	2.5	Kerry to visit Jordan, Israel-Palestinian peace on agenda	Kerry postpones visit to Israel in one week
main-news	headlines	2014	0328	4.4	Eurozone jobless hits fresh record high	EU jobless hits fresh record
main-news	headlines	2014	0330	1.4	Nelson Mandela's real hero was not Gandhi, but Nehru	Nelson Mandela's health 'unstable'
main-news	headlines	2014	0331	3	Facing Bailout Tax, Cypriots Try to Get Cash Out of Banks	Bailout terms prompt run on Cyprus banks
main-news	headlines	2014	0332	1.2	Obama signs up for Obamacare	Americans scramble to sign up for Obamacare by deadline
main-news	headlines	2014	0333	4.2	Lance Armstrong confesses all to Oprah	Lance Armstrong confesses to doping in Oprah interview
main-news	headlines	2014	0334	5	Andy Murray deserves knighthood, David Cameron says	David Cameron: Andy Murray deserves a knighthood
main-news	headlines	2014	0335	2	Hushen 300 Index closes higher -- Oct. 14	Hushen 300 Index closes lower -- March 12
main-news	headlines	2014	0336	2.4	US State Department faulted over Benghazi	State Dept security chief resigns after Benghazi
main-news	headlines	2014	0337	0	Soccer-France to host Australia for first time in October	NRA official to face questions for first time since controversial remarks
main-news	headlines	2014	0338	3.6	Honduran ambassador to Colombia sacked after wild party	Honduras ambassador resigns after alleged embassy orgy
main-news	headlines	2014	0339	2.4	Syria must destroy chemical weapons	Libya ‘destroys last chemical weapons’
main-news	headlines	2014	0340	0	Moderate tremor in the Central Mediterranean	Iran: Moderate candidate wins presidential vote
main-news	headlines	2014	0341	3.6	Three Afghans killed in suicide attack	Three Afghans dead in new blast at US base in east Afghanistan
main-news	headlines	2014	0342	2.8	Suicide Bombs Hit Egypt Military in Sinai, Kill 6	Suicide bombs hit Egypt military in Sinai, kill 4
main-news	headlines	2014	0343	3.4	Asian markets gain on upbeat US economic data	Asian markets lifted by positive US, China data
main-news	headlines	2014	0346	1.6	Suicide bomber kills 9 at Pakistan political rally	Suicide bomber kills guard at US embassy in Turkey
main-news	headlines	2014	0347	2.2	Four Morsi supporters killed in Egypt clashes	Dozens injured as Morsi supporters clash with security forces
main-news	headlines	2014	0348	0	Students take a ride on airwaves	5.5-magnitude quake hits off Taiwan
main-news	headlines	2014	0349	2.2	Pistorius officer dropped from case	Pistorius officer on attempted murder charges
main-news	headlines	2014	0350	4	Vinnie Jones reveals cancer battle new	Vinnie Jones reveals he has skin cancer
main-news	headlines	2014	0352	2.6	Pakistani Taliban chief Hakimullah Mehsud killed in drone strike	Pakistan Taliban vows revenge, to repay Hakimullah's killing in bloodshed
main-news	headlines	2014	0353	5	Dozens killed in air strike on bakery in central Syria	'Dozens killed' in Syrian air strike on bakery
main-news	headlines	2014	0354	2	Gunmen kill one soldier, injure two others in Pakistan	Gunmen kill 6 polio workers in Pakistan
main-news	headlines	2014	0355	2.2	Police confirm how suspect was captured	Raid on Boston Marathon bombing suspect captured on film
main-news	headlines	2014	0356	2.8	Destruction of Syria's chemical weapons begins	Destruction of Syria's Chemical Weapons Could Prove Difficult
main-news	headlines	2014	0357	0.8	Flooding in Canada forces evacuation of another city	California wildfire forces evacuation of homes, university
main-news	headlines	2014	0358	4.4	UN says US drones violate Pakistan's sovereignty	UN: US drone strikes violate Pakistan's sovereignty
main-news	headlines	2014	0359	4.8	Obama Praises Mandela 'Inspiration'	Obama hails Mandela's inspiration effect
main-news	headlines	2014	0360	0.8	Obama coming 'to listen' to Israel, Palestinians	Kerry Welcomes Arab Plan for Israeli-Palestinian Talks
main-news	headlines	2014	0361	4.2	The e-mails - Oil firm asked trader about meeting with minister	Oil firm asked rogue trader about meeting with minister
main-news	headlines	2014	0362	1.4	Death toll in Nigeria police attack rises to 30	Death toll in Kenya bus attack rises to six
main-news	headlines	2014	0363	2.6	Syria 'to declare chemical weapons and sign convention'	Russia, Syria Work on 'Concrete' Chemical Weapons Plan
main-news	headlines	2014	0364	0	Australia to scrap soaring national debt ceiling	Australian PM insists no argument with Indonesia
main-news	headlines	2014	0365	4.8	Asian markets hit 3-wk high on hopes of US debt deal	Asian stocks hit three-week highs on hopes of U.S. debt deal
main-news	headlines	2014	0366	1.4	Italian Prime Minister Mario Monti Resigns	'Palestinian Prime Minister Fayyad resigns'
main-news	headlines	2014	0367	3.2	South Africa Admits Mistake Over 'Schizophrenic' Mandela Signer	South Africa admits possible 'mistake' over deaf signer at Mandela memorial
"main-news	headlines	2014	0368	1.6	Iran says serious issues remain in nuclear talks	Iran vows to preserve ""peaceful"" nuclear program"
main-news	headlines	2014	0369	2	Crowds Gather in Bethlehem for Christmas	Oh, little town of Bethlehem — for real
main-news	headlines	2014	0370	1.6	Seven peacekeepers killed in Sudan's Darfur	Peacekeeper killed in Abyei clash
main-news	headlines	2014	0371	3.2	NATO: Patriot missile battery operational on Syrian border	Obama: Patriot missile batteries, troops to stay in Jordan near Syrian border
main-news	headlines	2014	0372	4.6	US stocks tumble on third day of shutdown	Stocks fall on third day of government shutdown
main-news	headlines	2014	0373	3.4	Guinea votes in long-delayed legislative poll	Equatoguineans vote in legislative polls
main-news	headlines	2014	0374	3	NATO: 3 troops killed in Afghanistan attack	NATO troops killed in Afghan 'insider attack'
main-news	headlines	2014	0375	1.2	Israeli soldier hits Palestinian child in Hebron	Israeli soldiers kill Palestinian woman in West Bank
main-news	headlines	2014	0376	2.2	UN voices alarm over Israeli strikes on Syria	Israeli official confirms second air strike at Syria
main-news	headlines	2014	0377	3.4	Egypt Army Launches New Air Raids on Sinai Militants	Egypt launches new assault against Sinai militants
main-news	headlines	2014	0378	2.6	French forces attack al-Qaeda's Mali allies	A battle to retake north Mali: Hundreds of French troops drive back al-Qaida-linked rebels
main-news	headlines	2014	0379	1.2	Egyptian police fire tear gas at Brotherhood protesters	India: Tear Gas Fired At Gang Rape Protesters
main-news	headlines	2014	0380	3	Syria Regime Agrees to Attend Peace Conference	Syria, opposition agree 'in principle' to attend peace conference
main-news	headlines	2014	0383	3.8	Dozens injured as Boeing 777 jet crash lands at San Francisco airport	Asiana Air Boeing 777 crash lands at San Francisco airport
main-news	headlines	2014	0384	4.6	13 children die in fire Myanmar mosque fire	Myanmar police say 13 children die in electrical fire at mosque
main-news	headlines	2014	0385	2.8	US Senate to vote on fiscal cliff deal as deadline nears	Fiscal cliff: House delays vote on fiscal cliff deal - live
main-news	headlines	2014	0388	2.2	Man with knife arrested at entrance to Buckingham Palace	Man Charged After Buckingham Palace Arrest
main-news	headlines	2014	0389	2.8	5 people buried in Colorado avalanche	'5 snowboarders killed in Colorado avalanche'
main-news	headlines	2014	0390	3.6	Ban Ki-moon to Review Syria Chemical Arms Accord	Ban to review Syria chemical arms accord
main-news	headlines	2014	0391	3.6	Iraqi president in hospital due to health problem	Iraqi president in hospital after suffering stroke
main-news	headlines	2014	0392	3.8	Malaysia's long-ruling coalition hangs on to power	Malaysia's ruling coalition wins majority
main-news	headlines	2014	0394	4.2	Explosions Near the Iranian Embassy in Beirut	Two blasts near Iranian embassy in Beirut
main-news	headlines	2014	0395	4.2	19 hurt in New Orleans shooting	Police: 19 hurt in NOLA Mother's Day shooting
"main-news	headlines	2014	0396	2.4	Hagel laments ""political"" changes to US defence budget	Hagel defends proposed cuts in defense spending"
main-news	headlines	2014	0397	4.4	U.S. bans carry-on liquids, gels on flights to Russia	US bans carry-on liquids on direct flights to Russia
main-news	headlines	2014	0398	2.4	Egypt's Brotherhood stands ground after killings	Egypt: Muslim Brotherhood Stands Behind Morsi
main-news	headlines	2014	0400	3	Nato troops kill two Afghan children	NATO strike kills 11 Afghan children
main-news	headlines	2014	0401	2	Iranian president calls for new nuclear talks	Iranian minister blames West for failed nuke talks
main-news	headlines	2014	0402	3.4	Floods kill two, forces 75,000 from Calgary homes	Flooding Forces 75,000 From Canada Homes
main-news	headlines	2014	0403	2.6	4 NATO Troops Killed in Afghanistan	Eight NATO Troops Killed In Afghanistan
main-news	headlines	2014	0404	3.8	Typhoon Fitow makes landfall in east China	Typhoon Fitow slams into southeastern China
main-news	headlines	2014	0405	0.2	Mandela to spend Christmas in hospital	Mandela movie to open this month in South Africa
main-news	headlines	2014	0406	3.4	Exit polls suggest Putin ally wins Moscow vote	Exit polls shows Putin ally wins Moscow vote, Navalny cries foul
main-news	headlines	2014	0407	4	Judge enters not guilty plea for James Holmes	Not guilty plea for James Holmes – but insanity option still on table
main-news	headlines	2014	0408	1	At least 45 killed in Spain train crash	At least 13 killed in triple car bombings in Iraq's Diyala
main-news	headlines	2014	0410	0	Chris Froome rides to Tour de France endgame	Chris Brown concerts cancelled new
main-news	headlines	2014	0411	3.6	Apple app directs drivers to Alaska airport runway	Apple app sends drivers to airport
main-news	headlines	2014	0412	3.4	Suspected US drone kills 3 militants in Pakistan	U.S. drone kills 4 militants in Pakistan
main-news	headlines	2014	0416	3.6	Francis begins papacy with prayer	Pope Francis Slips Out of Vatican for Prayers
